[
    {
        "batch-name": "<redacted-batch>",
        "batch-status": "CREATED",
        "batch-status-date": "2026-07-11T05:17:21.263Z",
        "can-be-unarchived": true,
        "combined-batch-mail-types": [
            "POSTAL_PARCEL"
        ],
        "courier-order-statuses": [
            "NOT_REQUIRED"
        ],
        "delivery-notice-payment-method": "PAID_RECIPIENT",
        "delivery-to-door": false,
        "delivery-to-door-rate-sum": 0,
        "delivery-to-door-rate-vat-sum": 0,
        "electronic-f103": false,
        "form-document-id": "<redacted-id>",
        "fragile-rate": 0,
        "fragile-rate-vat": 0,
        "has-timeslots": false,
        "international": false,
        "is-hyper-local": false,
        "is-postoffice-ukd": false,
        "list-number-date": "2026-07-11",
        "mail-category": "COMBINED",
        "mail-category-text": "Комбинированно",
        "mail-rank": "WO_RANK",
        "mail-type": "COMBINED",
        "mail-type-text": "Комбинированно",
        "payment-method": "CASHLESS",
        "postmarks": [
            "NONSTANDARD"
        ],
        "postoffice-address": "<redacted-address>",
        "postoffice-code": "109012",
        "postoffice-name": "ОПС ЗТ 109012",
        "pre-postal-preparation": false,
        "shipment-avia-rate-sum": 0,
        "shipment-avia-rate-vat-sum": 0,
        "shipment-completeness-checking-rate-sum": 0,
        "shipment-completeness-checking-rate-vat-sum": 0,
        "shipment-contents-checking-rate-sum": 0,
        "shipment-contents-checking-rate-vat-sum": 0,
        "shipment-count": 1,
        "shipment-functionality-checking-rate-sum": 0,
        "shipment-functionality-checking-rate-vat-sum": 0,
        "shipment-ground-rate-sum": 64590,
        "shipment-ground-rate-vat-sum": 14210,
        "shipment-insure-rate-sum": 0,
        "shipment-insure-rate-vat-sum": 0,
        "shipment-inventory-rate-sum": 0,
        "shipment-inventory-rate-vat-sum": 0,
        "shipment-mass": 1000,
        "shipment-mass-rate-sum": 64590,
        "shipment-mass-rate-vat-sum": 14210,
        "shipment-notice-rate-sum": 0,
        "shipment-notice-rate-vat-sum": 0,
        "shipment-partial-redemption-rate-sum": 0,
        "shipment-partial-redemption-rate-vat-sum": 0,
        "shipment-pre-postal-preparation-rate-sum": 0,
        "shipment-pre-postal-preparation-rate-vat-sum": 0,
        "shipment-sms-notice-rate-sum": 0,
        "shipment-sms-notice-rate-vat-sum": 0,
        "shipment-unloading-rate-sum": 0,
        "shipment-unloading-rate-vat-sum": 0,
        "shipment-volume": 0,
        "shipment-with-fitting-rate-sum": 0,
        "shipment-with-fitting-rate-vat-sum": 0,
        "shipping-notice-type": "SIMPLE",
        "transport-type": "SURFACE",
        "ukd": false,
        "use-online-balance": false,
        "wo-mass": false
    }
]
